{
  "type": "object",
  "id": "o-0004",
  "stream": "slitherlink-tool-granularity",
  "name": "Sonnet 4.6",
  "kind": "model",
  "description": "Mid-capability rung of the model ladder for the model x granularity sweep.",
  "attributes": {
    "id": "claude-sonnet-4-6",
    "capability": "medium",
    "price_in_per_mtok": "$3",
    "price_out_per_mtok": "$15",
    "context": "1M",
    "role": "mid rung"
  },
  "provenance": {
    "created_by": "human",
    "created_at": "2026-06-09T09:40:10.837Z",
    "updated_at": "2026-06-09T09:40:10.837Z"
  },
  "comments": {}
}
